3021,Raisin,"Digital Savings, WealthTech, Digital Banks","Digital Savings Collective / Pool, Savings-as-a-Service (SaaS), Robo-Advisors, Financial Comparison Sites, Pension-Led Funding, Digital Wealth Management, Banking-as-a-Service (BaaS)",2012.0,2013,Private,Germany,Germany,201-500,,,,Active
3022,Raison,"WealthTech, Cryptoasset Exchange, Digital Custody, Enterprise Tech Provisioning, Digital Capital Raising, Digital Payments","Personal Financial Management / Planning, Digital Wealth Management, Retail Brokerage Services, Single Dealer Platform / OTC Trading, Unhosted Cryptoasset Wallet, Digital Accounting, Token Hosting Platform, Consumer Spending",2017.0,2017,Private,Estonia,Estonia,Nov-50,,,,Active
3023,Raize,Digital Lending,P2P / Marketplace Business Lending,2014.0,2012,Public,Portugal,Portugal,6,,,,Active
3024,Raizers,"Digital Lending, Digital Capital Raising","P2P / Marketplace Business Lending, Equity-Based Crowdfunding, Real Estate Crowdfunding",2014.0,2011,Private,France,Switzerland,30,,,,Active
3025,RajaPremi,InsurTech,Comparison Portal,2013.0,2013,Private,Indonesia,Indonesia,Nov-50,,,,Active
3026,Rakuten,Cryptoasset Exchange,Order-Book,1997.0,2019,Public,Japan,Japan,,,,,Active
3027,Rally Rd,Digital Capital Raising,Equity-Based Crowdfunding,2016.0,2016,Private,United States,United States,Nov-50,,,,Active
3028,Ramp,"Enterprise Tech Provisioning, Digital Banks, Digital Payments","Financial Management & Business Intelligence, Digital Accounting, Electronic Invoicing, Agent Banking (Cash-In / Cash-Out), Money Transfer (P2P / P2B / B2P / B2B)",2019.0,2020,Private,United States,United States,51-200,,,,Active
3029,Rang De,Digital Lending,"P2P / Marketplace Consumer Lending, P2P / Marketplace Business Lending",2017.0,2008,Private,India,India,Nov-50,,,,Active
3030,RapiCredit,Digital Lending,Balance Sheet Consumer Lending,,2014,Private,Colombia,Colombia,51-200,,,,Active
3031,Rapidoo,Digital Lending,Invoice Trading,2016.0,2016,Private,Brazil,Brazil,6,,,,Active
3032,Rapidor,"Digital Payments, Enterprise Tech Provisioning","Payment Aggregators, Points of Access (PoS / mPoS / Online PoS), Digital Accounting",2013.0,2017,Private,India,India,Nov-50,,,,Active
3033,Rapipay,"Digital Banks, Digital Payments","Fully Digitally Native Bank (Retail), Points of Access (PoS / mPoS / Online PoS)",2009.0,2018,Private,India,India,1001-5000,,,,Active
3034,RappiPay,"Digital Payments, Digital Banks","Money Transfer (P2P / P2B / B2P / B2B), eMoney Issuers, Fully Digitally Native Bank (MSME), Fully Digitally Native Bank (Retail)",2015.0,2019,Private,Colombia,Colombia,51-200,,,,Active
3035,Rapyd,"Digital Payments, RegTech, Enterprise Tech Provisioning, Digital Identity","Payment Gateways, eMoney Issuers, Money Transfer (P2P / P2B / B2P / B2B), Acquiring Services Providers for Merchants, API Hubs for Payments, Mobile Money, Digital Remittances (Cross Border-P2P), Digital Remittances (Domestic-P2P), Points of Access (PoS / mPoS / Online PoS), Risk Analytics, API Management, Fraud Prevention & Risk Management",2016.0,2016,Private,United Kingdom,United Kingdom,201-500,,,,Active
3036,RateSetter,Digital Lending,"P2P / Marketplace Business Lending, P2P / Marketplace Consumer Lending, P2P / Marketplace Property Lending",2010.0,2010,Private,United Kingdom,United Kingdom,376,,,,Active
3037,Ravelin,"RegTech, Digital Identity, Enterprise Tech Provisioning","Risk Analytics, Fraud Prevention & Risk Management, Financial Management & Business Intelligence",2014.0,2015,Private,United Kingdom,United Kingdom,51-200,,,,Active
3038,RAWX,Cryptoasset Exchange,Order-Book,2013.0,2013,Private,Unidentified,Unidentified,,2016.0,,,Inactive
3039,Razorpay,"Enterprise Tech Provisioning, Digital Payments, RegTech, Digital Lending, Digital Banks","API Management, Cloud Computing, Electronic Invoicing, AI / ML / NLP, Digital Accounting, Payment Gateways, Acquiring Services Providers for Merchants, API Hubs for Payments, Regulatory Reporting, Risk Analytics, Balance Sheet Business Lending, Fully Digitally Native Bank (MSME)",2013.0,2014,Private,India,India,1001-5000,,,,Active
3040,RE-Lender,"Digital Lending, Digital Capital Raising","P2P / Marketplace Business Lending, Real Estate Crowdfunding",2019.0,2020,Private,Italy,Italy,10-Jan,,,,Active
3041,ReaCapital,Digital Capital Raising,Real Estate Crowdfunding,2014.0,2015,Private,Germany,Germany,,,,,Active
3042,Real Funds,Digital Lending,P2P / Marketplace Property Lending,,2015,Private,United Kingdom,United Kingdom,,,,,Active
3043,RealCrowd,Digital Capital Raising,Real Estate Crowdfunding,2013.0,2013,Private,United States,United States,30,,,,Active
3044,Realty Africa,Digital Capital Raising,Real Estate Crowdfunding,2014.0,2014,Private,South Africa,South Africa,10-Jan,,,,Active
3045,RealtyMogul,"Digital Lending, Digital Capital Raising","P2P / Marketplace Property Lending, Real Estate Crowdfunding",2012.0,2015,Private,United States,United States,76,,,,Active
3046,RealtyShares,Digital Capital Raising,Real Estate Crowdfunding,2013.0,2013,Private,United States,United States,76,,,,Active
3047,RealtyWealth,Digital Capital Raising,Real Estate Crowdfunding,2006.0,2007,Private,United States,United States,6,,,,Active
3048,RealVantage,WealthTech,"Personal Financial Management / Planning, Digital Wealth Management, Education and Training",2019.0,2020,Private,Singapore,Singapore,Nov-50,,,,Active
3049,RealX,"Enterprise Tech Provisioning, WealthTech, Digital Capital Raising","Enterprise Blockchain, Personal Financial Management / Planning, Financial Comparison Sites, Equity-Based Crowdfunding, Real Estate Crowdfunding",2016.0,2017,Private,India,India,7,,,,Active
3050,Reask,InsurTech,"Claims & Risk Management Solutions, Technical Service Provider (TSP)",2018.0,2017,Private,Australia,Australia,10-Jan,,,,Active
3051,Rebanking,Digital Lending,"Balance Sheet Consumer Lending, Invoice Trading, Balance Sheet Business Lending",2017.0,2017,Private,Argentina,Argentina,176,,,,Active
3052,Rebeja Tus Cuentas,Digital Lending,"P2P / Marketplace Business Lending, P2P / Marketplace Consumer Lending, P2P / Marketplace Property Lending, Education and Training",2017.0,2017,Private,Peru,Peru,10-Jan,,,,Active
3053,Rebel,Digital Lending,Balance Sheet Consumer Lending,,2016,Private,Brazil,Brazil,51-200,,,,Active
3054,Rebit,Digital Payments,Money Transfer (Cryptoasset),2014.0,2014,Private,Philippines,Philippines,Nov-50,2020.0,,,Inactive
3055,rebuildingsociety.com,Digital Lending,P2P / Marketplace Business Lending,2012.0,2012,Private,United Kingdom,United Kingdom,30,,,,Active
3056,recaudia,Digital Capital Raising,Donation-Based Crowdfunding,2015.0,2015,Private,Mexico,Mexico,,,,,Active
3057,Recharge,Enterprise Tech Provisioning,API Management,2019.0,2014,Private,United States,United States,501-1000,,,,Active
3058,Recko,Enterprise Tech Provisioning,Financial Management & Business Intelligence,2017.0,2019,Private,India,India,51-200,,,,Active
3059,Recordent,Enterprise Tech Provisioning,Financial Management & Business Intelligence,2018.0,2020,Private,India,India,Nov-50,,,,Active
3060,RecoverCoins.io,Digital Custody,Key Management Services,,2019,Private,Unidentified,Unidentified,,,,,Active
3061,Recurly,"Enterprise Tech Provisioning, Digital Payments","Electronic Invoicing, API Management, Money Transfer (P2P / P2B / B2P / B2B)",2009.0,2010,Private,United States,United States,201-500,,,,Active
3062,Red Dot Payment,Digital Payments,"Payment Gateways, Acquiring Services Providers for Merchants",2011.0,2013,Private,Singapore,Singapore,51-200,,,,Active
3063,RedCapital,Digital Lending,"P2P / Marketplace Business Lending, P2P / Marketplace Property Lending, Invoice Trading",2014.0,2014,Private,Chile,Chile,30,,,,Active
3064,RedCarpet,"Digital Payments, Digital Lending, WealthTech","Money Transfer (P2P / P2B / B2P / B2B), Customer Cash-Advance, Balance Sheet Consumer Lending, Personal Financial Management / Planning",2016.0,2016,Private,India,India,Nov-50,,,,Active
3065,RedCloud Technologies,Digital Payments,"Payment Gateways, Mobile Money, Money Transfer (P2P / P2B / B2P / B2B), Points of Access (PoS / mPoS / Online PoS), Top-ups & Refills, Digital Remittances (Domestic-P2P)",2012.0,2012,Private,United Kingdom,United Kingdom,51-200,,,,Active
3066,REDD Intelligence,RegTech,"Market Monitoring, Market data, Market surveillance",2014.0,2014,Private,United States,United States,Nov-50,,,,Active
3067,Refinn,"WealthTech, Digital Lending","Financial Comparison Sites, P2P / Marketplace Property Lending, P2P / Marketplace Consumer Lending",2015.0,2016,Private,Thailand,Thailand,Nov-50,,,,Active
3068,ReGal 38I83,"Cryptoasset Exchange, RegTech, Digital Banks, Enterprise Tech Provisioning","Advanced Trading Services, Risk Analytics, Profiling & Due Diligence, Dynamic Compliance, Banking-as-a-Service (BaaS), AI / ML / NLP, Enterprise Blockchain",2018.0,2018,Private,United Kingdom,United Kingdom,Nov-50,,,,Active
3069,Regtify,RegTech,"Regulatory Reporting, Risk Analytics, Dynamic Compliance",2016.0,2016,Private,Cyprus,Cyprus,Nov-50,,,,Active
3070,Relay ,"Enterprise Tech Provisioning, Digital Payments","Electronic Invoicing, Digital Accounting, Financial Management & Business Intelligence, Money Transfer (P2P / P2B / B2P / B2B)",2019.0,2020,Private,United States,United States,51-200,,,,Active
3071,Relendex,Digital Lending,P2P / Marketplace Property Lending,2013.0,2013,Private,United Kingdom,United Kingdom,30,,,,Active
3072,Remedinet,InsurTech,"Claims & Risk Management Solutions, Technical Service Provider (TSP)",2006.0,2006,Private,India,India,51-200,,,,Active
3073,RemitAnalyst,"Digital Payments, Enterprise Tech Provisioning","Digital Remittances (Cross Border-P2P), AI / ML / NLP, Market surveillance, Data aggregation",2019.0,2019,Private,United States,United States,10-Jan,,,,Active
3074,RemitGuru,Digital Payments,Digital Remittances (Cross Border-P2P),1999.0,2013,Private,India,India,51-200,,,,Active
3075,Remitly,Digital Payments,Digital Remittances (Cross Border-P2P),2011.0,2012,Private,United States,United States,1001-5000,,,,Active
3076,RemitOnline,Digital Payments,Payment Gateways,,2017,Private,India,India,,2019.0,,,Inactive
3077,Rendity,Digital Capital Raising,Real Estate Crowdfunding,2014.0,2015,Private,Austria,Austria,6,,,,Active
3078,RenewBuy,InsurTech,"Digital Brokers or Agents, Comparison Portal",2013.0,2015,Private,India,India,1001-5000,,,,Active
3079,Renexe,RegTech,"Risk Analytics, Portfolio management",2019.0,2019,Private,Finland,Finland,10-Jan,,,,Active
3080,Renrendai,Digital Lending,P2P / Marketplace Consumer Lending,2010.0,2010,Private,China,China,6,,,,Active
3081,Renrenmoney,Digital Lending,"P2P / Marketplace Business Lending, P2P / Marketplace Consumer Lending, Financial Solution Provider and Consulting Service",2011.0,2012,Private,China,China,6,,,,Active
3082,Rent.com,Digital Lending,P2P / Marketplace Consumer Lending,2016.0,2000,Private,"Korea, Rep.",United States,76,,,,Active
3083,Reonomy ,Enterprise Tech Provisioning,"AI / ML / NLP, Financial Management & Business Intelligence, API Management",2013.0,2014,Private,United States,United States,51-200,,,,Active
3084,RePay Africa,"Digital Payments, Enterprise Tech Provisioning","API Hubs for Payments, Digital Remittances (Domestic-P2P), Money Transfer (P2P / P2B / B2P / B2B), Acquiring Services Providers for Merchants, Top-ups & Refills, Mobile Money, Digital Remittances (Cross Border-P2P), Financial Management & Business Intelligence, Digital Accounting",,2020,Private,Kenya,Kenya,Nov-50,,,,Active
3085,Republic,Digital Capital Raising,Equity-Based Crowdfunding,2013.0,2013,Private,United States,United States,176,,,,Active
3086,Reputation Transfer,"Digital Banks, Digital Capital Raising, Digital Lending, InsurTech","Fully Digitally Native Bank (Retail), Revenue / Profit Share Crowdfunding, P2P / Marketplace Consumer Lending, Reward-Based Crowdfunding, Equity-Based Crowdfunding, Fully Digitally Native Bank (MSME), Technical Service Provider (TSP), Donation-Based Crowdfunding, Crowd-Led Microfinance",2017.0,2017,Private,United Kingdom,United Kingdom,10-Jan,,,,Active
3087,Resilient Business Systems,"Enterprise Tech Provisioning, Digital Payments, InsurTech","Cloud Computing, Digital Accounting, Financial Management & Business Intelligence, Points of Access (PoS / mPoS / Online PoS), Money Transfer (P2P / P2B / B2P / B2B), Claims & Risk Management Solutions",2012.0,2016,Private,Kenya,Kenya,Nov-50,,,,Active
3088,Retail Capital,Digital Lending,Balance Sheet Business Lending,,2011,Private,Unidentified,South Africa,51-200,,,,Active
3089,Rete del Dono,Digital Capital Raising,Donation-Based Crowdfunding,2013.0,2013,Private,Italy,Italy,30,,,,Active
3090,Revfin,Digital Lending,"Balance Sheet Consumer Lending, Balance Sheet Business Lending",2018.0,2018,Private,India,India,51-200,,,,Active
3091,Revolut,"Cryptoasset Exchange, Digital Custody, Digital Banks, Digital Payments","Aggregation, Retail Brokerage Services, Hosted Cryptoasset Wallet, Fully Digitally Native Bank (Retail), Money Transfer (P2P / P2B / B2P / B2B)",2013.0,2014,Private,United Kingdom,United Kingdom,1001-5000,,,,Active
3092,Rextie,Digital Lending,Invoice Trading,2016.0,2016,Private,Unidentified,Peru,Nov-50,,,,Active
3093,Rezolve Limited,Digital Payments,"API Hubs for Payments, Application development, Software oracle",2015.0,2016,Private,United Kingdom,United Kingdom,Nov-50,,,,Active
3094,Rhino,InsurTech,"Digital Brokers or Agents, Customer Management",2017.0,2016,Private,United States,United States,201-500,,,,Active
3095,Rho Business Banking,"Enterprise Tech Provisioning, Digital Banks","Digital Accounting, Fully Digitally Native Bank (MSME)",2018.0,2019,Private,United States,United States,51-200,,,,Active
3096,Rich Data Corporation,"Alternative Credit Analytics, Enterprise Tech Provisioning","Credit Scoring, AI / ML / NLP",2016.0,2016,Private,Singapore,Australia,51-200,,,,Active
3097,RightBTC,Cryptoasset Exchange,"Advanced Trading Services, Order-Book, High-Frequency Trading (HFT) Services, Single Dealer Platform / OTC Trading",2014.0,2018,Private,United Arab Emirates,"Hong Kong SAR, China",51-200,,,,Active
3098,Ringan,Digital Lending,P2P / Marketplace Consumer Lending,2018.0,2020,Private,Indonesia,Indonesia,51-200,,,,Active
3099,Ripio,"Digital Payments, Cryptoasset Exchange, Digital Lending, WealthTech","Payment processor, Retail Brokerage Services, Order-Book, Single Dealer Platform / OTC Trading, Balance Sheet Consumer Lending, Personal Financial Management / Planning",2013.0,2013,Private,Argentina,Argentina,201-500,,,,Active
3100,Ripple,Enterprise Tech Provisioning,Enterprise Blockchain,2012.0,2013,Private,United States,United States,201-500,,,,Active
3101,Risika,"RegTech, Enterprise Tech Provisioning, Alternative Credit Analytics","Risk Analytics, AI / ML / NLP, Credit Scoring",2016.0,2017,Private,Denmark,Denmark,Nov-50,,,,Active
3102,Risk Priorities,RegTech,"Profiling & Due Diligence, Risk Analytics, Dynamic Compliance, Regulatory Reporting, Data aggregation",2014.0,2014,Private,United States,United States,10-Jan,,,,Active
3103,Risk+ Solutions,"RegTech, Enterprise Tech Provisioning","Risk Analytics, Financial Management & Business Intelligence",2017.0,2018,Private,Lebanon,Lebanon,10-Jan,,,,Active
3104,Riskalyze,Enterprise Tech Provisioning,Financial Management & Business Intelligence,2011.0,2010,Private,United States,United States,201-500,,,,Active
3105,RiskGenius,Enterprise Tech Provisioning,AI / ML / NLP,2015.0,2016,Private,United States,United States,25,,,,Active
3106,Riskified,"RegTech, Enterprise Tech Provisioning, Digital Identity","Risk Analytics, Financial Management & Business Intelligence, AI / ML / NLP, Fraud Prevention & Risk Management",2012.0,2012,Public,Israel,Israel,501-1000,,,,Active
3107,Rnwl,InsurTech,Digital Brokers or Agents,2019.0,2019,Private,United Kingdom,United Kingdom,10-Jan,,,,Active
3108,Roadoor.com,Digital Lending,"P2P / Marketplace Business Lending, P2P / Marketplace Consumer Lending",2009.0,2011,Private,China,China,750,,,,Active
3109,RoadPass ,"Digital Payments, Enterprise Tech Provisioning, Digital Banks","Payment Gateways, API Hubs for Payments, Digital Remittances (Domestic-P2P), Money Transfer (P2P / P2B / B2P / B2B), Points of Access (PoS / mPoS / Online PoS), eMoney Issuers, API Management, Cloud Computing, AI / ML / NLP, Banking-as-a-Service (BaaS)",,2017,Private,Brazil,Brazil,Nov-50,,,,Active
3110,Robinhood,"Digital Payments, Cryptoasset Exchange, WealthTech","Money Transfer (Cryptoasset), Order-Book, Retail Brokerage Services, Digital Wealth Management, Personal Financial Management / Planning",2013.0,2014,Public,United States,United States,1001-5000,,,,Active
3111,ROBO WEB TECH,Digital Lending,"P2P / Marketplace Business Lending, P2P / Marketplace Consumer Lending, P2P / Marketplace Property Lending",,2015,Private,Unidentified,"Taiwan, China",Nov-50,,,,Active
3112,Robo.cash,Digital Lending,P2P / Marketplace Consumer Lending,2017.0,2017,Private,Croatia,Croatia,6,,,,Active
3113,Robobo,Digital Payments,"Payment Gateways, Payment Aggregators, Money Transfer (P2P / P2B / B2P / B2B), API Hubs for Payments",2011.0,2011,Private,United Kingdom,United Kingdom,,,,,Active
3114,Robocash Group,Digital Lending,"Balance Sheet Business Lending, Balance Sheet Consumer Lending, P2P / Marketplace Business Lending, P2P / Marketplace Consumer Lending",2015.0,2013,Private,Singapore,Singapore,94,,,,Active
3115,Robot Fund,"Enterprise Tech Provisioning, WealthTech","Digital Accounting, Robo-Advisors",2016.0,2017,Private,Japan,Japan,Nov-50,,,,Active
3116,Robowealth,WealthTech,Robo-Advisors,2016.0,2018,Private,Thailand,Thailand,137,,,,Active
3117,Rockpapr,"Enterprise Tech Provisioning, Digital Payments","Financial Management & Business Intelligence, Digital Accounting, Money Transfer (P2P / P2B / B2P / B2B), API Hubs for Payments, eMoney Issuers",2018.0,2018,Private,United States,United States,10-Jan,,,,Active
3118,ROINET Solution,"Digital Banks, Digital Payments","Agent Banking (Cash-In / Cash-Out), Money Transfer (P2P / P2B / B2P / B2B), Top-ups & Refills",2012.0,2017,Private,India,India,201-500,,,,Active
3119,Romit,"Cryptoasset Exchange, Digital Custody, Digital Payments","Bitcoin Teller Machines (BTM), Hosted Cryptoasset Wallet, Money Transfer (Cryptoasset)",2014.0,2013,Private,United States,United States,,2016.0,,,Inactive
3120,Rong360,WealthTech,"Financial Comparison Sites, Digital Wealth Management, Robo-Advisors, Market data, Industry research",2011.0,2012,Private,China,China,51-200,,,,Active
3121,Rongjinsuo,Digital Lending,"P2P / Marketplace Business Lending, P2P / Marketplace Consumer Lending",2013.0,2013,Private,China,China,,,,,Active
3122,Roofstock,"WealthTech, Digital Lending","Digital Wealth Management, Personal Financial Management / Planning, P2P / Marketplace Property Lending",2014.0,2016,Private,United States,United States,201-500,,,,Active
3123,Roojai,InsurTech,Digital Brokers or Agents,2014.0,2014,Private,Thailand,Thailand,79,,,,Active
3124,Roostify,Digital Lending,"P2P / Marketplace Business Lending, P2P / Marketplace Consumer Lending",2012.0,2012,Private,United States,United States,51-200,,,,Active
3125,Root Insurance,InsurTech,Digital Brokers or Agents,2019.0,2015,Public,United States,United States,1001-5000,,,,Active
3126,Rootfi,Enterprise Tech Provisioning,API Management,2020.0,2020,Private,India,India,10-Jan,,,,Active
3127,RSK,Digital Payments,"Money Transfer (Cryptoasset), Payment processor, Application development",,2015,Private,Gibraltar,Argentina,,,,,Active
3128,Rubique,"Digital Lending, InsurTech","Balance Sheet Consumer Lending, Balance Sheet Business Lending, Balance Sheet Property Lending, Digital Brokers or Agents",2014.0,2016,Private,India,India,,2019.0,,,Inactive
3129,Rukula,Digital Lending,Balance Sheet Consumer Lending,,2015,Private,Sri Lanka,Sri Lanka,18,,,,Active
3130,Rupaiya Exchange,Digital Lending,"P2P / Marketplace Business Lending, P2P / Marketplace Consumer Lending",2015.0,2015,Private,India,India,6,,,,Active
3131,RupeeCircle,Digital Lending,P2P / Marketplace Consumer Lending,2017.0,2017,Private,India,India,30,,,,Active
3132,Rupeek,Digital Lending,Balance Sheet Consumer Lending,2015.0,2015,Private,India,India,1001-5000,,,,Active
3133,RupeeRedee,"Digital Lending, Digital Identity, Alternative Credit Analytics, Digital Banks","P2P / Marketplace Business Lending, KYC Solutions, Credit Scoring, Banking-as-a-Service (BaaS)",2018.0,2018,Private,India,India,Nov-50,,,,Active
3134,Rupiah Cepat,Digital Lending,P2P / Marketplace Consumer Lending,2019.0,2018,Private,Indonesia,Indonesia,501-1000,,,,Active
3135,Rupiah Token Indonesia,Digital Payments,Asset-Backed Stablecoin,,2019,Private,Indonesia,Indonesia,Nov-50,,,,Active
3136,Rupifi,"Digital Lending, Digital Payments","Merchant Cash-Advance, Balance Sheet Business Lending, Payment Gateways",2020.0,2020,Private,India,India,51-200,,,,Active
3137,Ruplee,Digital Payments,Money Transfer (P2P / P2B / B2P / B2B),2014.0,2014,Volunteer,India,India,51-200,2017.0,,,Inactive
3138,Ruptok,Digital Lending,Balance Sheet Consumer Lending,2019.0,2021,Private,India,India,Nov-50,,,,Active
3139,RuralNet,"InsurTech, Enterprise Tech Provisioning","Technical Service Provider (TSP), API Management, Financial Management & Business Intelligence",,2012,Private,Philippines,Philippines,,,,,Active
3140,RusBit,Cryptoasset Exchange,Bitcoin Teller Machines (BTM),,2017,Private,Russian Federation,Russian Federation,,,,,Active
3141,Ryanada,"Digital Lending, Enterprise Tech Provisioning","P2P / Marketplace Consumer Lending, Cloud Computing, AI / ML / NLP, Application development",2011.0,2011,Private,Kenya,Kenya,27,,,,Active
3142,Ryskex,InsurTech,"P2P Insurance, Parametric-Based Insurance, Digital Brokers or Agents, Claims & Risk Management Solutions, On-Demand Insurance",2018.0,2016,Private,Germany,Germany,10-Jan,,,,Active
3143,Rntgen,Digital Capital Raising,Real Estate Crowdfunding,2017.0,2017,Private,Lithuania,Lithuania,6,,,,Active
3144,SaBi,Cryptoasset Exchange,"Order-Book, Single Dealer Platform / OTC Trading, Advanced Trading Services",2019.0,2019,Private,Unidentified,Nigeria,10-Jan,,,,Active
3145,SabPaisa,"Digital Payments, Enterprise Tech Provisioning","API Hubs for Payments, Payment Aggregators, Bulk Payment Solutions, Acquiring Services Providers for Merchants, Payment Gateways, Points of Access (PoS / mPoS / Online PoS), Electronic Invoicing",2016.0,2016,Private,India,India,51-200,,,,Active
3146,SABR.io,RegTech,Blockchain Forensics,2015.0,2015,Private,United States,United States,,2016.0,,,Inactive
3147,SAC,Digital Lending,P2P / Marketplace Business Lending,1998.0,1998,Private,Mexico,"Korea, Rep.",6,,,,Active
3148,SadaPay,Digital Payments,Money Transfer (P2P / P2B / B2P / B2B),2019.0,2020,Private,Pakistan,Pakistan,51-200,,,,Active
3149,Safaricom,"Digital Payments, Digital Identity, Alternative Credit Analytics, WealthTech","Payment Gateways, KYC Solutions, Fraud Prevention & Risk Management, Mobile Money, Money Transfer (P2P / P2B / B2P / B2B), Payment Aggregators, Bulk Payment Solutions, Security & Biometrics, Credit Scoring, Digital Wealth Management, Digital Remittances (Cross Border-P2P), Digital Remittances (Domestic-P2P)",1997.0,1997,Private,Kenya,Kenya,5001-10000,,,,Active
3150,Safebit,Digital Custody,Hosted Cryptoasset Wallet,2011.0,2011,Private,Israel,Israel,,2013.0,,,Inactive
3151,Safello,"Cryptoasset Exchange, Digital Custody","Retail Brokerage Services, Unhosted Cryptoasset Wallet",2013.0,2013,Private,Sweden,Sweden,,,,,Active
3152,SafetyPay,"Digital Payments, Enterprise Tech Provisioning","Acquiring Services Providers for Merchants, Digital Remittances (Cross Border-P2P), Digital Remittances (Domestic-P2P), Payment Gateways, Digital Accounting, Electronic Invoicing",2003.0,2006,Private,United States,United States,51-200,,,,Active
3153,Safexpay,Digital Payments,"Payment Aggregators, Payment Gateways",2017.0,2017,Private,India,India,51-200,,,,Active
3154,Saffe,"Digital Banks, Digital Identity, Enterprise Tech Provisioning, Digital Lending","Fully Digitally Native Bank (Retail), Fraud Prevention & Risk Management, KYC Solutions, AI / ML / NLP, P2P / Marketplace Consumer Lending, Merchant Cash-Advance, Agent Banking (Cash-In / Cash-Out)",2015.0,2015,Private,Germany,Germany,Nov-50,,,,Active
3155,Sagi Ltd.,"Enterprise Tech Provisioning, Digital Payments","Financial Management & Business Intelligence, Cloud Computing, Mobile Money, eMoney Issuers",2020.0,2020,Private,Kazakhstan,Kazakhstan,10-Jan,,,,Active
3156,Saharey,Digital Capital Raising,Donation-Based Crowdfunding,2009.0,2010,Non profit,United States,Pakistan,,2019.0,,,Inactive
3157,Saida,"WealthTech, Digital Payments","Personal Financial Management / Planning, Digital Remittances (Domestic-P2P), Money Transfer (P2P / P2B / B2P / B2B), Top-ups & Refills",2015.0,2015,Private,United States,Kenya,,,,,Active
3158,Salary Finance,"Digital Lending, WealthTech, Digital Savings","Balance Sheet Consumer Lending, Digital Wealth Management, Personal Financial Management / Planning, Digital Micro Saving Solutions, Education and Training",2015.0,2015,Private,United Kingdom,United Kingdom,51-200,,,,Active
3159,SalaryBook,Digital Payments,Bulk Payment Solutions,2022.0,2021,Private,India,India,Nov-50,,,,Active
3160,SalaryFits,Digital Lending,P2P / Marketplace Consumer Lending,2015.0,2015,Private,United Kingdom,United Kingdom,76,,,,Active
3161,Saldo.mx,Digital Payments,Top-ups & Refills,2014.0,2014,Private,United States,Mexico,10-Jan,,,,Active
3162,SaltPay,"Digital Payments, Digital Lending","Points of Access (PoS / mPoS / Online PoS), Payment Aggregators, Acquiring Services Providers for Merchants, Top-ups & Refills, Customer Cash-Advance",2019.0,2019,Private,United Kingdom,United Kingdom,501-1000,,,,Active
3163,Salud Facil,Digital Lending,"P2P / Marketplace Business Lending, P2P / Marketplace Consumer Lending, Balance Sheet Consumer Lending, Balance Sheet Business Lending",2013.0,2013,Private,Mexico,Mexico,30,,,,Active
