916,Coinut,Cryptoasset Exchange,Order-Book,2013.0,2013,Private,Singapore,Singapore,,,,,Active
917,Coinverse,"Cryptoasset Exchange, Digital Payments","Retail Brokerage Services, Bitcoin Teller Machines (BTM), Money Transfer (Cryptoasset), Payment processor",2014.0,2014,Private,Brazil,Brazil,,2015.0,,,Inactive
918,CoinWallet,Digital Custody,Unhosted Cryptoasset Wallet,2015.0,2015,Private,Malta,Malta,,,,,Active
919,CoinX,Cryptoasset Exchange,Order-Book,2013.0,2013,Private,United States,United States,,2015.0,,,Inactive
920,Coinzone,"Digital Payments, Digital Custody","Payment processor, Hosted Cryptoasset Wallet",2014.0,2014,Private,Netherlands,Netherlands,,2015.0,,,Inactive
921,Colectual,Digital Lending,P2P / Marketplace Business Lending,2015.0,2015,Private,Spain,Spain,30,,,,Active
922,Colendi,"Digital Lending, Alternative Credit Analytics, Digital Payments, Digital Identity","Customer Cash-Advance, P2P / Marketplace Consumer Lending, P2P / Marketplace Business Lending, Balance Sheet Consumer Lending, Balance Sheet Business Lending, Merchant Cash-Advance, Credit Scoring, eMoney Issuers, Fraud Prevention & Risk Management, API Interface",,2016,Private,Switzerland,Switzerland,Nov-50,,,,Active
923,CollBox,"Enterprise Tech Provisioning, InsurTech","Cloud Computing, Digital Accounting, Digital Brokers or Agents",2015.0,2016,Private,United States,United States,10,,,,Active
924,Collectim,Digital Capital Raising,"Donation-Based Crowdfunding, Reward-Based Crowdfunding",2014.0,2014,Private,Bulgaria,Bulgaria,10-Jan,,,,Active
925,Collective Benefits,InsurTech,"Parametric-Based Insurance, On-Demand Insurance",2019.0,2020,Private,United Kingdom,United Kingdom,Nov-50,,,,Active
926,Collective Health,"Digital Savings, Enterprise Tech Provisioning","Savings-as-a-Service (SaaS), Financial Management & Business Intelligence",2013.0,2014,Private,United States,United States,501-1000,,,,Active
927,College Ave Student Loans,Digital Lending,P2P / Marketplace Consumer Lending,2014.0,2014,Private,United States,United States,30,,,,Active
928,Colleo,Digital Capital Raising,Donation-Based Crowdfunding,2013.0,2013,Private,France,France,10-Jan,,,,Active
929,Collin Crowdfund,"Digital Lending, Digital Capital Raising","P2P / Marketplace Business Lending, Balance Sheet Business Lending, Real Estate Crowdfunding",2013.0,2014,Private,Netherlands,Netherlands,,,,,Active
930,Colu,Digital Payments,Payment processor,2014.0,2015,Private,Israel,Israel,,,,,Active
931,ComKort,Cryptoasset Exchange,Order-Book,2014.0,2014,Private,United Kingdom,United Kingdom,,2015.0,,,Inactive
932,Commercial Passport,"Enterprise Tech Provisioning, Digital Identity","Enterprise Blockchain, KYC Solutions",,2014,Private,Switzerland,Switzerland,Nov-50,,,,Active
933,CommonBond,Digital Lending,"P2P / Marketplace Consumer Lending, Balance Sheet Consumer Lending",2011.0,2012,Private,United States,United States,176,,,,Active
934,Community Investment Management,Digital Lending,P2P / Marketplace Business Lending,2012.0,2014,Private,United States,United States,6,,,,Active
935,Community Sourced Capital,Digital Lending,P2P / Marketplace Business Lending,2012.0,2013,Private,United States,United States,6,,,,Active
936,Companisto,"Digital Capital Raising, Digital Lending","Equity-Based Crowdfunding, Debt-Based Securities",2012.0,2012,Private,Germany,Germany,30,,,,Active
937,Comparabien,WealthTech,Financial Comparison Sites,,2010,Private,Peru,Peru,Nov-50,,,,Active
938,ComparaOnline,Digital Lending,"P2P / Marketplace Business Lending, P2P / Marketplace Consumer Lending, P2P / Marketplace Property Lending",2009.0,2009,Private,Chile,Chile,376,,,,Active
939,Compare4Benefit,WealthTech,Financial Comparison Sites,2017.0,2018,Private,United Arab Emirates,United Arab Emirates,10-Jan,,,,Active
940,Compass Mining,Consensus Services,Equipment Procurement & Financing,2020.0,2021,Private,United States,United States,Nov-50,,,,Active
941,ComplyAdvantage,"RegTech, Enterprise Tech Provisioning, Digital Identity","Profiling & Due Diligence, Dynamic Compliance, Risk Analytics, AI / ML / NLP, KYC Solutions, KYC & AML",2014.0,2014,Private,United Kingdom,United Kingdom,201-500,,,,Active
942,Compound,Digital Lending,"P2P / Marketplace Consumer Lending, P2P / Marketplace Business Lending",2017.0,2017,Private,United States,United States,Nov-50,,,,Active
943,COMUNIDAD 4UNO,InsurTech,Digital Brokers or Agents,,2016,Private,Unidentified,Mexico,,,,,Active
944,Comunitae,Digital Lending,"P2P / Marketplace Consumer Lending, Debt-Based Securities",2008.0,2008,Private,Spain,Spain,10-Jan,2018.0,,,Inactive
945,Concirrus,"InsurTech, Enterprise Tech Provisioning","IoT (including Telematics), AI / ML / NLP, Cloud Computing",2011.0,2012,Private,United Kingdom,United Kingdom,51-200,,,,Active
946,Concordium Foundation,Consensus Services,Firmware & Software Development,2018.0,2021,Private,Switzerland,Switzerland,Nov-50,,,,Active
947,Concrete,Digital Capital Raising,"Equity-Based Crowdfunding, Real Estate Crowdfunding",2004.0,2004,Private,Italy,United Kingdom,76,,,,Active
948,CONDA Crowdinvesting sterreich,Digital Capital Raising,Equity-Based Crowdfunding,2012.0,2013,Private,Austria,Austria,6,,,,Active
949,Conectabitcoin,Cryptoasset Exchange,P2P Cryptoasset Marketplaces,,2013,Private,Singapore,Argentina,,2014.0,,,Inactive
950,Confirmo,"Digital Payments, Cryptoasset Exchange","Payment processor, Order-Book",2014.0,2014,Private,United Kingdom,United Kingdom,,,,,Active
951,Conio,"Digital Custody, Digital Payments, Cryptoasset Exchange","Hosted Cryptoasset Wallet, Payment processor, Consumer Spending, Points of Access (Cryptoasset), Retail Brokerage Services",2015.0,2017,Private,United States,United States,Nov-50,,,,Active
952,ConnectABank,WealthTech,Financial Comparison Sites,2011.0,2014,Private,India,India,10-Jan,,,,Active
953,ConnectionPoint,Digital Capital Raising,"Reward-Based Crowdfunding, Donation-Based Crowdfunding",2008.0,2009,Private,Canada,Canada,Nov-50,,,,Active
954,Consensys,"Enterprise Tech Provisioning, Digital Payments, Consensus Services, RegTech, Cryptoasset Exchange, Digital Capital Raising, Digital Custody","Enterprise Blockchain, Financial Management & Business Intelligence, Money Transfer (Cryptoasset), Payment processor, Staking-as-a-Service, Dynamic Compliance, Aggregation, Token Hosting Platform, Hosted Cryptoasset Wallet",2014.0,2014,Private,United States,United States,501-1000,,,,Active
955,Consilium Crypto,Cryptoasset Exchange,"High-Frequency Trading (HFT) Services, Aggregation, Market data, Market surveillance",2018.0,2018,Private,Canada,Canada,Nov-50,,,,Active
956,Consolid8,"Enterprise Tech Provisioning, RegTech, WealthTech","Digital Accounting, Cloud Computing, Dynamic Compliance, Personal Financial Management / Planning, Education and Training",2007.0,2007,Private,Australia,Australia,Nov-50,,,,Active
957,ContaAzul ,"WealthTech, Enterprise Tech Provisioning","Personal Financial Management / Planning, Electronic Invoicing",2011.0,2011,Private,Brazil,Brazil,201-500,,,,Active
958,Continuity,"RegTech, Enterprise Tech Provisioning","Dynamic Compliance, Risk Analytics, Digital Accounting, AI / ML / NLP, Education and Training",2009.0,2008,Private,United States,United States,51-200,,,,Active
959,Copper,Cryptoasset Exchange,Institutional Brokerage Services,2018.0,2018,Private,United Kingdom,United Kingdom,,,,,Active
960,Core Scientific,Consensus Services,"Remote Hosting Services, Firmware & Software Development",2018.0,2017,Private,United States,United States,,,,,Active
961,Corl,"Digital Capital Raising, Enterprise Tech Provisioning, Digital Lending, Alternative Credit Analytics","Revenue / Profit Share Crowdfunding, AI / ML / NLP, Balance Sheet Business Lending, Credit Scoring",2016.0,2016,Private,Canada,Canada,10-Jan,,,,Active
962,Corvus Insurance,"Enterprise Tech Provisioning, Digital Identity","Financial Management & Business Intelligence, AI / ML / NLP, API Management, Fraud Prevention & Risk Management",2016.0,2018,Private,United States,United States,201-500,,,,Active
963,Counterparty,Digital Custody,"Sub-segment protocols / construction, Unhosted Cryptoasset Wallet",2013.0,2014,Private,Decentralised Autonomous Organisations,Decentralised Autonomous Organisations,,,,,Active
964,Countingup,"Enterprise Tech Provisioning, Digital Payments, Digital Banks","Digital Accounting, Electronic Invoicing, eMoney Issuers, Fully Digitally Native Bank (MSME)",2017.0,2017,Private,United Kingdom,United Kingdom,Nov-50,,,,Active
965,Covault,Cryptoasset Exchange,Bitcoin Teller Machines (BTM),,2017,Private,United States,United States,,,,,Active
966,Coverfox Insurance,"InsurTech, WealthTech, Digital Savings","Digital Brokers or Agents, Comparison Portal, Personal Financial Management / Planning, Digital Wealth Management, Digital Money Market / Fund  ",2013.0,2013,Private,India,India,1001-5000,,,,Active
967,Cowbell Cyber,"Enterprise Tech Provisioning, InsurTech, RegTech","AI / ML / NLP, Cloud Computing, Digital Brokers or Agents, Risk Analytics",2019.0,2019,Private,United States,United States,51-200,,,,Active
968,CowFunding,Digital Capital Raising,Donation-Based Crowdfunding,2013.0,2013,Private,France,France,6,,,,Active
969,Cowrywise,"WealthTech, Digital Savings","Digital Money Market / Fund, Digital Wealth Management, Personal Financial Management / Planning, Digital Micro Saving Solutions, Digital Savings Collective / Pool",2017.0,2017,Private,Nigeria,Nigeria,Nov-50,,,,Active
970,Coya,InsurTech,Digital Brokers or Agents,2017.0,2018,Private,Germany,Germany,51-200,2022.0,,,Active
971,Coyno,Enterprise Tech Provisioning,"Digital Accounting, Financial Management & Business Intelligence, Taxation",2014.0,2015,Private,Germany,Germany,10-Jan,2017.0,,,Inactive
972,Craft Silicon,"Digital Banks, Enterprise Tech Provisioning","Banking-as-a-Service (BaaS), Financial Management & Business Intelligence, API Management",2000.0,2000,Private,Kenya,Kenya,51-200,,,,Active
973,Crassula,"Digital Payments, Enterprise Tech Provisioning, Digital Banks, RegTech, Digital Identity, Cryptoasset Exchange","Payment Gateways, Money Transfer (P2P / P2B / B2P / B2B), Payment Aggregators, Top-ups & Refills, API Hubs for Payments, Digital Remittances (Cross Border-P2P), Acquiring Services Providers for Merchants, Payment processor, Money Transfer (Cryptoasset), API Management, Cloud Computing, Banking-as-a-Service (BaaS), Dynamic Compliance, Fraud Prevention & Risk Management, Retail Brokerage Services",2003.0,2015,Private,Latvia,Latvia,Nov-50,,,,Active
974,CRC (COMPLIANCE RISK CONCEPTS),RegTech,"Risk Analytics, Dynamic Compliance, Regulatory Reporting, Profiling & Due Diligence, Education and Training",2011.0,2013,Private,United States,United States,Nov-50,,,,Active
975,CRECE ECUADOR,"Digital Lending, Alternative Credit Analytics, Digital Capital Raising","P2P / Marketplace Business Lending, Credit Scoring, Equity-Based Crowdfunding",2018.0,2018,Private,Ecuador,Ecuador,10-Jan,,,,Active
976,Cred,Digital Capital Raising,"Capital Raising Retail Brokerage, Lending / Borrowing, Interest-bearing account",2018.0,2018,Private,United States,United States,201-500,,,,Active
977,CredAvenue ,"Alternative Credit Analytics, Digital Lending, Enterprise Tech Provisioning","Credit Scoring, Invoice Trading, P2P / Marketplace Consumer Lending, Debt-Based Securities, P2P / Marketplace Business Lending, Financial Management & Business Intelligence",2020.0,2020,Private,India,India,201-500,,,,Active
978,Credenc,Digital Lending,Balance Sheet Consumer Lending,2017.0,2017,Private,India,India,51-200,,,,Active
979,CredFine,WealthTech,Financial Comparison Sites,2020.0,2020,Private,India,India,51-200,,,,Active
980,Credibility Capital,Digital Lending,P2P / Marketplace Business Lending,2013.0,2015,Private,United States,United States,Nov-50,,,,Active
981,Crediblock.com,"Digital Payments, Digital Lending","Payment Aggregators, Payment Gateways, Balance Sheet Business Lending, Data aggregation, Software oracle",2019.0,2019,Private,United States,United States,Nov-50,,,,Active
982,Credibly,Digital Lending,Balance Sheet Business Lending,2010.0,2010,Private,United States,United States,176,,,,Active
983,CrediFace,"Digital Lending, Alternative Credit Analytics","Balance Sheet Consumer Lending, Alternative Credit Rating Agency",2018.0,2015,Private,Peru,Peru,,,,,Active
984,Credify,Digital Lending,P2P / Marketplace Business Lending,2013.0,2014,Private,Mexico,Singapore,6,,,,Active
985,Credijusto,Digital Lending,Balance Sheet Business Lending,2014.0,2015,Private,Mexico,Mexico,376,,,,Active
986,Credility,Digital Lending,"P2P / Marketplace Business Lending, Invoice Trading",2016.0,2016,Private,Argentina,Argentina,6,,,,Active
987,Credime ,Digital Lending,Balance Sheet Consumer Lending,2019.0,2019,Private,India,India,Nov-50,2022.0,,,Active
988,Credimi,Digital Lending,"P2P / Marketplace Business Lending, Invoice Trading",2015.0,2010,Private,Italy,Italy,6,,,,Active
989,Credin,Digital Lending,Balance Sheet Consumer Lending,2019.0,2020,Private,India,India,Nov-50,,,,Active
990,Credisfera,Digital Lending,P2P / Marketplace Consumer Lending,2015.0,2015,Private,Brazil,Brazil,,,,,Active
991,Credit Culture,Digital Lending,Balance Sheet Consumer Lending,2016.0,2016,Private,Singapore,Singapore,Nov-50,,,,Active
992,Credit Fair,Digital Lending,Balance Sheet Consumer Lending,2018.0,2018,Private,India,India,Nov-50,,,,Active
993,Credit Karma,"Alternative Credit Analytics, Digital Identity, WealthTech, Digital Savings, InsurTech, Digital Lending, Digital Banks","Credit Scoring, Fraud Prevention & Risk Management, Financial Comparison Sites, Digital Micro Saving Solutions, Comparison Portal, Digital Brokers or Agents, P2P / Marketplace Business Lending, P2P / Marketplace Consumer Lending, P2P / Marketplace Property Lending, Agent Banking (Cash-In / Cash-Out), Education and Training",2007.0,2008,Private,United States,United States,1001-5000,,,,Active
994,Credit Sesame,"WealthTech, Digital Payments","Financial Comparison Sites, Personal Financial Management / Planning, Money Transfer (P2P / P2B / B2P / B2B)",2010.0,2010,Private,United States,United States,201-500,,,,Active
995,Credit Wise Capital,Digital Lending,Balance Sheet Consumer Lending,2018.0,2018,Private,India,India,51-200,,,,Active
996,Credit.fr,Digital Lending,P2P / Marketplace Business Lending,2016.0,2016,Private,France,France,30,,,,Active
997,CreditAccess Grameen,Digital Lending,"Balance Sheet Consumer Lending, Balance Sheet Business Lending",1991.0,2008,Public,India,India,10001-,,,,Active
998,Creditas,"WealthTech, Digital Banks, InsurTech, Digital Lending, Alternative Credit Analytics","Personal Financial Management / Planning, Financial Comparison Sites, Agent Banking (Cash-In / Cash-Out), Comparison Portal, P2P / Marketplace Property Lending, P2P / Marketplace Consumer Lending, Debt-Based Securities, P2P / Marketplace Business Lending, Credit Scoring, Education and Training",2012.0,2012,Private,Brazil,Brazil,1001-5000,,,,Active
999,Creditea,Digital Lending,Balance Sheet Consumer Lending,2019.0,2016,Private,Mexico,Mexico,10001-,,,,Active
1000,CreditFinance,Digital Lending,"P2P / Marketplace Business Lending, P2P / Marketplace Consumer Lending",2012.0,2012,Private,China,China,76,,,,Active
1001,Creditlah,Digital Lending,P2P / Marketplace Business Lending,2017.0,2017,Private,India,India,6,,,,Active
1002,CreditMantri,"WealthTech, Alternative Credit Analytics, Digital Lending, InsurTech","Personal Financial Management / Planning, Credit Scoring, P2P / Marketplace Consumer Lending, P2P / Marketplace Property Lending, Comparison Portal",2012.0,2012,Private,India,India,51-200,,,,Active
1003,CreditNirvana,Enterprise Tech Provisioning,AI / ML / NLP,2019.0,2020,Private,India,United States,51-200,,,,Active
1004,CreditPer,Digital Lending,"Balance Sheet Business Lending, Balance Sheet Consumer Lending",2016.0,2017,Private,Pakistan,Pakistan,Nov-50,,,,Active
1005,Creditplace,Digital Lending,"P2P / Marketplace Business Lending, Invoice Trading",2013.0,2013,Private,Israel,Israel,6,,,,Active
1006,creditshelf,Digital Lending,Balance Sheet Business Lending,,2015,Public,Germany,Germany,51-200,,,,Active
1007,CreditSnap,"Enterprise Tech Provisioning, Alternative Credit Analytics, Digital Identity","AI / ML / NLP, Credit Scoring, KYC Solutions, Security & Biometrics, Fraud Prevention & Risk Management, Education and Training, KYC & AML",2017.0,2018,Private,United States,United States,10-Jan,,,,Active
1008,Creditt ,Digital Lending,Balance Sheet Consumer Lending,2017.0,2019,Private,India,India,51-200,,,,Active
1009,CreditVidya,"Alternative Credit Analytics, WealthTech, Digital Lending, Enterprise Tech Provisioning, RegTech","Credit Scoring, Personal Financial Management / Planning, P2P / Marketplace Consumer Lending, Financial Management & Business Intelligence, Profiling & Due Diligence",2012.0,2012,Private,India,India,51-200,,,,Active
1010,Crediwatch,"Enterprise Tech Provisioning, RegTech, Digital Identity","Financial Management & Business Intelligence, Profiling & Due Diligence, Risk Analytics, Regulatory Reporting, KYC Solutions",2016.0,2016,Private,India,India,51-200,,,,Active
1011,CredoLab,Alternative Credit Analytics,"Alternative Credit Rating Agency, Credit Scoring",2016.0,2016,Private,Singapore,Singapore,36,,,,Active
1012,CredPal ,"Digital Lending, Enterprise Tech Provisioning, Alternative Credit Analytics, RegTech","Customer Cash-Advance, P2P / Marketplace Consumer Lending, Balance Sheet Business Lending, Financial Management & Business Intelligence, Credit Scoring, Risk Analytics",2018.0,2017,Private,Nigeria,Nigeria,Nov-50,,,,Active
1013,CredRight ,Digital Lending,Balance Sheet Business Lending,2016.0,2016,Private,India,India,Nov-50,,,,Active
1014,Credy ,Digital Lending,P2P / Marketplace Consumer Lending,,2016,Private,India,India,Nov-50,,,,Active
1015,Crestem Idei,Digital Capital Raising,Reward-Based Crowdfunding,2012.0,2012,Private,Romania,Romania,6,,,,Active
1016,Creze,Digital Lending,Balance Sheet Business Lending,2014.0,2015,Private,Mexico,Mexico,30,,,,Active
1017,Criptopi,Digital Lending,Balance Sheet Consumer Lending,,2019,Private,Colombia,Colombia,,,,,Active
1018,CroFun,"Digital Capital Raising, Digital Lending","Reward-Based Crowdfunding, Donation-Based Crowdfunding, P2P / Marketplace Business Lending",2013.0,2013,Private,Belgium,Belgium,,,,,Active
1019,Cross River Bank,"Digital Lending, Digital Banks, Digital Payments, RegTech","Balance Sheet Property Lending, Balance Sheet Business Lending, P2P / Marketplace Business Lending, P2P / Marketplace Consumer Lending, Banking-as-a-Service (BaaS), Fully Digitally Native Bank (MSME), Marketplace Bank (MSME), API Hubs for Payments, Dynamic Compliance",,2008,Private,Unidentified,United States,201-500,,,,Active
1020,CrossBorder Solutions,Enterprise Tech Provisioning,"AI / ML / NLP, Digital Accounting",2015.0,2016,Private,United States,Russian Federation,201-500,,,,Active
1021,Crossflow - The Working Capital Marketplace,"Digital Lending, Digital Payments, Enterprise Tech Provisioning, Alternative Credit Analytics","P2P / Marketplace Business Lending, Money Transfer (P2P / P2B / B2P / B2B), Financial Management & Business Intelligence, Credit Scoring",2013.0,2013,Private,United Kingdom,United Kingdom,Nov-50,,,,Active
1022,Crowd Asset,"Digital Lending, WealthTech","P2P / Marketplace Business Lending, Digital Wealth Management",2018.0,2019,Private,Mongolia,Mongolia,Nov-50,,,,Active
1023,Crowd Capital,Digital Capital Raising,Real Estate Crowdfunding,2019.0,2018,Private,United States,United States,10-Jan,,,,Active
1024,CROWD CREDIT,Digital Lending,P2P / Marketplace Business Lending,2013.0,2013,Private,Japan,Japan,76,,,,Active
1025,Crowd Culture,Digital Capital Raising,"Reward-Based Crowdfunding, Donation-Based Crowdfunding",2009.0,2009,Private,Sweden,Sweden,,,,,Active
1026,Crowd for Angels (UK),"Digital Capital Raising, Digital Lending","Equity-Based Crowdfunding, Debt-Based Securities",1995.0,2013,Private,United Kingdom,United Kingdom,6,,,,Active
1027,Crowd Realty,Digital Capital Raising,Real Estate Crowdfunding,2014.0,2016,Private,Japan,Japan,30,,,,Active
1028,Crowd'in,Digital Capital Raising,"Equity-Based Crowdfunding, Donation-Based Crowdfunding, Reward-Based Crowdfunding",2014.0,2014,Private,Belgium,Belgium,10-Jan,,,,Active
1029,Crowd.Science,Digital Capital Raising,Reward-Based Crowdfunding,2013.0,2014,Private,United Kingdom,United Kingdom,6,,,,Active
1030,Crowd2Fund,Digital Lending,P2P / Marketplace Business Lending,2014.0,2014,Private,United Kingdom,United Kingdom,6,,,,Active
1031,CrowdAboutNow,"Digital Capital Raising, Digital Lending","Reward-Based Crowdfunding, P2P / Marketplace Business Lending, Equity-Based Crowdfunding",2009.0,2011,Private,Netherlands,Netherlands,6,,,,Active
1032,Crowdahouse,Digital Lending,P2P / Marketplace Property Lending,2012.0,2015,Private,United Kingdom,United Kingdom,6,,,,Active
1033,Crowdberry,Digital Capital Raising,Equity-Based Crowdfunding,2015.0,2015,Private,Slovak Republic,Slovak Republic,Nov-50,,,,Active
1034,Crowdcube,Digital Capital Raising,Equity-Based Crowdfunding,2010.0,2011,Private,United Kingdom,United Kingdom,76,,,,Active
1035,CrowdDana,Digital Capital Raising,Real Estate Crowdfunding,2019.0,2019,Private,Indonesia,Indonesia,10-Jan,,,,Active
1036,CrowdDesk,Digital Capital Raising,Equity-Based Crowdfunding,2015.0,2015,Private,Germany,Germany,Nov-50,,,,Active
1037,CROWDE,"Digital Lending, Digital Capital Raising","P2P / Marketplace Business Lending, Revenue / Profit Share Crowdfunding, Invoice Trading",2016.0,2016,Private,Indonesia,Indonesia,30,,,,Active
1038,Crowdera,Digital Capital Raising,"Reward-Based Crowdfunding, Donation-Based Crowdfunding",2014.0,2014,Private,United States,United States,30,,,,Active
1039,Crowdestate,"Digital Lending, Digital Capital Raising","P2P / Marketplace Business Lending, Real Estate Crowdfunding",2015.0,2016,Private,Estonia,Estonia,30,,,,Active
1040,Crowdestor,"Digital Capital Raising, Alternative Credit Analytics","Real Estate Crowdfunding, Revenue / Profit Share Crowdfunding, Equity-Based Crowdfunding, Donation-Based Crowdfunding, Credit Scoring",2017.0,2018,Private,Estonia,Estonia,Nov-50,,,,Active
1041,crowdFON,Digital Capital Raising,Reward-Based Crowdfunding,2011.0,2011,Private,Turkey,Turkey,6,,,,Active
1042,Crowdfunder UK,Digital Capital Raising,"Reward-Based Crowdfunding, Community Shares, Donation-Based Crowdfunding",2011.0,2011,Private,United Kingdom,United Kingdom,51-200,,,,Active
1043,Crowdfunding Bank,"Digital Capital Raising, Digital Lending","Equity-Based Crowdfunding, Donation-Based Crowdfunding, P2P / Marketplace Business Lending",2010.0,2011,Private,United States,United States,30,2016.0,,,Inactive
1044,Crowdfunding Portugal,Digital Capital Raising,Revenue / Profit Share Crowdfunding,2011.0,2011,Private,Portugal,Portugal,10-Jan,2018.0,,,Inactive
1045,CrowdFundMe,"Digital Capital Raising, Digital Lending","Equity-Based Crowdfunding, Mini-Bonds, Real Estate Crowdfunding",2013.0,2015,Private,Italy,Italy,6,,,,Active
1046,CrowdfundUP,"Digital Lending, Digital Capital Raising","P2P / Marketplace Property Lending, Real Estate Crowdfunding",2012.0,2015,Private,Australia,Australia,30,,,,Active
1047,CrowdfundX,Digital Capital Raising,Equity-Based Crowdfunding,2016.0,2016,Private,United States,United States,6,,,,Active
1048,Crowdify,Digital Capital Raising,"Donation-Based Crowdfunding, Reward-Based Crowdfunding",2011.0,2012,Private,Switzerland,Switzerland,10-Jan,,,,Active
1049,CROWDIUM,"Digital Capital Raising, WealthTech","Real Estate Crowdfunding, Personal Financial Management / Planning",2015.0,2015,Private,Argentina,Argentina,Nov-50,,,,Active
1050,CrowdLords,Digital Capital Raising,Real Estate Crowdfunding,2014.0,2015,Private,United Kingdom,United Kingdom,6,,,,Active
1051,Crowdmii,Digital Capital Raising,Reward-Based Crowdfunding,2013.0,2015,Private,Israel,Israel,6,,,,Active
1052,Crowdo,"Digital Lending, Digital Capital Raising","P2P / Marketplace Business Lending, P2P / Marketplace Consumer Lending, Equity-Based Crowdfunding",2012.0,2013,Private,Singapore,Singapore,30,,,,Active
1053,CrowdPatent,Digital Capital Raising,Equity-Based Crowdfunding,2013.0,2015,Private,Germany,Germany,6,,,,Active
1054,CrowdPlus.asia,Digital Capital Raising,Equity-Based Crowdfunding,2015.0,2016,Private,Malaysia,Malaysia,30,,,,Active
1055,CrowdProperty,Digital Lending,P2P / Marketplace Property Lending,2014.0,2014,Private,United Kingdom,United Kingdom,30,,,,Active
1056,CrowdRise,Digital Capital Raising,Donation-Based Crowdfunding,2010.0,2010,Private,United States,United States,176,,,,Active
1057,Crowdsphere,Digital Capital Raising,"Real Estate Crowdfunding, Equity-Based Crowdfunding",2014.0,2014,Private,New Zealand,New Zealand,10-Jan,,,,Active
1058,Crowdstacker,Digital Lending,"P2P / Marketplace Business Lending, Debt-Based Securities",2014.0,2015,Private,United Kingdom,United Kingdom,30,,,,Active
1059,CrowdStreet,Digital Capital Raising,Real Estate Crowdfunding,2013.0,2014,Private,United States,United States,176,,,,Active
1060,Crowdy,Digital Capital Raising,"Equity-Based Crowdfunding, Revenue / Profit Share Crowdfunding, Donation-Based Crowdfunding",2015.0,2016,Private,"Korea, Rep.","Korea, Rep.",30,,,,Active
1061,Crowdz,Digital Lending,Merchant Cash-Advance,2014.0,2014,Private,United States,United States,Nov-50,,,,Active
1062,CRXzone,"Cryptoasset Exchange, Digital Payments","Single Dealer Platform / OTC Trading, Payment processor, Order-Book",2014.0,2014,Private,Singapore,Singapore,,,,,Active
1063,Cryfter,Digital Payments,Consumer Spending,,2013,Private,Unidentified,United States,,2017.0,,,Inactive
1064,Crypterium,"Digital Custody, Cryptoasset Exchange, Digital Payments","Hosted Cryptoasset Wallet, Retail Brokerage Services, Top-ups & Refill (Cryptoasset), Money Transfer (Cryptoasset), Consumer Spending",2017.0,2017,Private,Estonia,Estonia,Nov-50,,,,Active
1065,Crypto 205,Consensus Services,Proprietary Hashing,2017.0,2017,Private,Canada,Canada,,2018.0,,,Inactive
